"rank","itemUrl","itemTitle","author","description","genres","genrecount"
"64","/book/show/77203.The_Kite_Runner","The Kite Runner","Khaled Hosseini","“It may be unfair, but what happens in a few days, sometimes even a single day, can change the course of a whole lifetime."" Amir is the son of a wealthy Kabul merchant, a member of the ruling caste of Pashtuns. Hassan, his servant and constant companion, is a Hazara, a despised and impoverished caste. Their uncommon bond is torn by Amir's choice to abandon his friend amid
   “It may be unfair, but what happens in a few days, sometimes even a single day, can change the course of a whole lifetime."" Amir is the son of a wealthy Kabul merchant, a member of the ruling caste of Pashtuns. Hassan, his servant and constant companion, is a Hazara, a despised and impoverished caste. Their uncommon bond is torn by Amir's choice to abandon his friend amidst the increasing ethnic, religious, and political tensions of the dying years of the Afghan monarchy, wrenching them far apart. But so strong is the bond between the two boys that Amir journeys back to a distant world, to try to right past wrongs against the only true friend he ever had.The unforgettable, heartbreaking story of the unlikely friendship between a wealthy boy and the son of his father’s servant, The Kite Runner is a beautifully crafted novel set in a country that is in the process of being destroyed. It is about the power of reading, the price of betrayal, and the possibility of redemption; and an exploration of the power of fathers over sons—their love, their sacrifices, their lies.A sweeping story of family, love, and friendship told against the devastating backdrop of the history of Afghanistan over the last thirty years, The Kite Runner is an unusual and powerful novel that has become a beloved, one-of-a-kind classic.
  ...more","/genres/fiction;/genres/historical-fiction;/genres/contemporary;/genres/classics;/genres/novels;/genres/literature;/genres/adult;/genres/adult-fiction;/genres/historical;/genres/drama","11,311 users;3,596 users;1,219 users;908 users;894 users;756 users;732 users;691 users;635 users;610 users"
"65","/book/show/3590.The_Adventures_of_Sherlock_Holmes","The Adventures of Sherlock Holmes (Sherlock Holmes, #3)","Arthur Conan Doyle","Complete in nine handsome volumes, each with an introduction by a Doyle scholar, a chronology, a selected bibliography, and explanatory notes, the Oxford Sherlock Holmes series offers a definitive collection of the famous detective's adventures. No home library is complete without it.Comprising the series of short stories that made the fortunes of the Strand, the magazine
  Complete in nine handsome volumes, each with an introduction by a Doyle scholar, a chronology, a selected bibliography, and explanatory notes, the Oxford Sherlock Holmes series offers a definitive collection of the famous detective's adventures. No home library is complete without it.Comprising the series of short stories that made the fortunes of the Strand, the magazine in which they were first published, this volume won even more popularity for Sherlock Holmes and Dr. Watson. Holmes is at the height of his powers in many of his most famous cases, including The Red-Headed League, The Speckled Band, and The Blue Carbuncle.
  ...more","/genres/classics;/genres/mystery;/genres/fiction;/genres/short-stories;/genres/crime;/genres/detective;/genres/literature;/genres/adventure;/genres/historical-fiction;/genres/british-literature","4,675 users;3,441 users;2,060 users;927 users;801 users;374 users;270 users;222 users;190 users;188 users"
"66","/book/show/10917.My_Sister_s_Keeper","My Sister's Keeper","Jodi Picoult","Anna is not sick, but she might as well be. By age thirteen, she has undergone countless surgeries, transfusions, and shots so that her older sister, Kate, can somehow fight the leukemia that has plagued her since childhood. The product of preimplantation genetic diagnosis, Anna was conceived as a bone marrow match for Kate -- a life and a role that she has never challenge
  Anna is not sick, but she might as well be. By age thirteen, she has undergone countless surgeries, transfusions, and shots so that her older sister, Kate, can somehow fight the leukemia that has plagued her since childhood. The product of preimplantation genetic diagnosis, Anna was conceived as a bone marrow match for Kate -- a life and a role that she has never challenged... until now. Like most teenagers, Anna is beginning to question who she truly is. But unlike most teenagers, she has always been defined in terms of her sister—and so Anna makes a decision that for most would be unthinkable, a decision that will tear her family apart and have perhaps fatal consequences for the sister she loves.A provocative novel that raises some important ethical issues, My Sister's Keeper is the story of one family's struggle for survival at all human costs and a stunning parable for all time.
  ...more","/genres/fiction;/genres/contemporary;/genres/chick-lit","4,624 users;903 users;884 users"
"67","/book/show/3636.The_Giver","The Giver (The Giver, #1)","Lois Lowry","This haunting story centers on Jonas, who lives in a seemingly ideal, if colorless, world of conformity and contentment. Not until he's given his life assignment as the Receiver of Memory does he begin to understand the dark, complex secrets behind his fragile community.","/genres/childrens;/genres/teen;/genres/read-for-school;/genres/middle-grade;/genres/fiction;/genres/science-fiction-fantasy","802 users;475 users;448 users;415 users;351 users;285 users"
"68","/book/show/332613.One_Flew_Over_the_Cuckoo_s_Nest","One Flew Over the Cuckoo's Nest","Ken Kesey","""In this classic of the 1960s, Ken Kesey's hero is Randle Patrick McMurphy, a boisterous, brawling, fun-loving rebel who swaggers into the world of a mental hospital and takes over. A lusty, life-affirming fighter, McMurphy rallies the other patients around him by challenging the dictatorship of Nurse Ratched. He promotes gambling in the ward, smuggles in wine and women, a
  ""In this classic of the 1960s, Ken Kesey's hero is Randle Patrick McMurphy, a boisterous, brawling, fun-loving rebel who swaggers into the world of a mental hospital and takes over. A lusty, life-affirming fighter, McMurphy rallies the other patients around him by challenging the dictatorship of Nurse Ratched. He promotes gambling in the ward, smuggles in wine and women, and openly defies the rules at every turn. But this defiance, which starts as a sport, soon develops into a grim struggle, an all-out war between two relentless opponents: Nurse Ratched, back by the full power of authority, and McMurphy, who has only his own indomitable will. What happens when Nurse Ratched uses her ultimate weapon against McMurphy provides the story's shocking climax.
  ...more","/genres/classics;/genres/fiction;/genres/literature;/genres/psychology","6,255 users;5,028 users;652 users;613 users"
"69","/book/show/6514.The_Bell_Jar","The Bell Jar","Sylvia Plath","Sylvia Plath's shocking, realistic, and intensely emotional novel about a woman falling into the grip of insanity. Esther Greenwood is brilliant, beautiful, enormously talented, and successful, but slowly going under—maybe for the last time. In her acclaimed and enduring masterwork, Sylvia Plath brilliantly draws the reader into Esther's breakdown with such intensity that
  Sylvia Plath's shocking, realistic, and intensely emotional novel about a woman falling into the grip of insanity. Esther Greenwood is brilliant, beautiful, enormously talented, and successful, but slowly going under—maybe for the last time. In her acclaimed and enduring masterwork, Sylvia Plath brilliantly draws the reader into Esther's breakdown with such intensity that her insanity becomes palpably real, even rational—as accessible an experience as going to the movies. A deep penetration into the darkest and most harrowing corners of the human psyche, The Bell Jar is an extraordinary accomplishment and a haunting American classic.
  ...more","/genres/classics;/genres/fiction;/genres/literary-fiction;/genres/contemporary;/genres/feminism","998 users;568 users;279 users;260 users;233 users"
"70","/book/show/38447.The_Handmaid_s_Tale","The Handmaid's Tale","Margaret Atwood","Offred is a Handmaid in the Republic of Gilead. She may leave the home of the Commander and his wife once a day to walk to food markets whose signs are now pictures instead of words because women are no longer allowed to read. She must lie on her back once a month and pray that the Commander makes her pregnant, because in an age of declining births, Offred and the other Ha
  Offred is a Handmaid in the Republic of Gilead. She may leave the home of the Commander and his wife once a day to walk to food markets whose signs are now pictures instead of words because women are no longer allowed to read. She must lie on her back once a month and pray that the Commander makes her pregnant, because in an age of declining births, Offred and the other Handmaids are valued only if their ovaries are viable. Offred can remember the years before, when she lived and made love with her husband, Luke; when she played with and protected her daughter; when she had a job, money of her own, and access to knowledge. But all of that is gone now...
  ...more","/genres/fiction;/genres/classics;/genres/dystopia;/genres/science-fiction;/genres/feminism","8,148 users;4,669 users;3,599 users;2,223 users;1,751 users"
"71","/book/show/10964.Outlander","Outlander (Outlander #1)","Diana Gabaldon","The year is 1945. Claire Randall, a former combat nurse, is just back from the war and reunited with her husband on a second honeymoon when she walks through a standing stone in one of the ancient circles that dot the British Isles. Suddenly she is a Sassenach—an “outlander”—in a Scotland torn by war and raiding border clans in the year of Our Lord...1743.Hurled back in ti
  The year is 1945. Claire Randall, a former combat nurse, is just back from the war and reunited with her husband on a second honeymoon when she walks through a standing stone in one of the ancient circles that dot the British Isles. Suddenly she is a Sassenach—an “outlander”—in a Scotland torn by war and raiding border clans in the year of Our Lord...1743.Hurled back in time by forces she cannot understand, Claire is catapulted into the intrigues of lairds and spies that may threaten her life, and shatter her heart. For here James Fraser, a gallant young Scots warrior, shows her a love so absolute that Claire becomes a woman torn between fidelity and desire—and between two vastly different men in two irreconcilable lives.
  ...more","/genres/historical-fiction;/genres/romance;/genres/fantasy;/genres/fiction;/genres/time-travel;/genres/historical;/genres/historical-romance","8,072 users;5,909 users;4,816 users;3,615 users;2,816 users;2,584 users;1,748 users"
"72","/book/show/15823480-anna-karenina","Anna Karenina","Leo Tolstoy;Louise Maude;Aylmer Maude","Leo Tolstoy’s classic story of doomed love is one of the most admired novels in world literature. Generations of readers have been enthralled by his magnificent heroine, the unhappily married Anna Karenina, and her tragic affair with dashing Count Vronsky.In their world frivolous liaisons are commonplace, but Anna and Vronsky’s consuming passion makes them a target for sco
  Leo Tolstoy’s classic story of doomed love is one of the most admired novels in world literature. Generations of readers have been enthralled by his magnificent heroine, the unhappily married Anna Karenina, and her tragic affair with dashing Count Vronsky.In their world frivolous liaisons are commonplace, but Anna and Vronsky’s consuming passion makes them a target for scorn and leads to Anna’s increasing isolation. The heartbreaking trajectory of their relationship contrasts sharply with the colorful swirl of friends and family members who surround them, especially the newlyweds Kitty and Levin, who forge a touching bond as they struggle to make a life together. Anna Karenina is a masterpiece not only because of the unforgettable woman at its core and the stark drama of her fate, but also because it explores and illuminates the deepest questions about how to live a fulfilled life. Translated by Louise and Aylmer Maude 
  ...more","/genres/classics;/genres/fiction;/genres/russia;/genres/romance;/genres/literature;/genres/historical-fiction;/genres/russian-literature;/genres/novels;/genres/19th-century;/genres/historical","12,977 users;4,808 users;1,293 users;1,124 users;1,067 users;1,048 users;986 users;548 users;433 users;405 users"
"73","/book/show/14891.A_Tree_Grows_in_Brooklyn","A Tree Grows in Brooklyn","Betty  Smith","The beloved American classic about a young girl's coming-of-age at the turn of the century, Betty Smith's A Tree Grows in Brooklyn is a poignant and moving tale filled with compassion and cruelty, laughter and heartache, crowded with life and people and incident. The story of young, sensitive, and idealistic Francie Nolan and her bittersweet formative years in the slums of
  The beloved American classic about a young girl's coming-of-age at the turn of the century, Betty Smith's A Tree Grows in Brooklyn is a poignant and moving tale filled with compassion and cruelty, laughter and heartache, crowded with life and people and incident. The story of young, sensitive, and idealistic Francie Nolan and her bittersweet formative years in the slums of Williamsburg has enchanted and inspired millions of readers for more than sixty years. By turns overwhelming, sublime, heartbreaking, and uplifting, the daily experiences of the unforgettable Nolans are raw with honesty and tenderly threaded with family connectedness -- in a work of literary art that brilliantly captures a unique time and place as well as incredibly rich moments of universal experience.
  ...more","/genres/classics;/genres/historical-fiction;/genres/young-adult;/genres/fiction","5,098 users;1,486 users;863 users;820 users"
"74","/book/show/3.Harry_Potter_and_the_Sorcerer_s_Stone","Harry Potter and the Sorcerer's Stone (Harry Potter, #1)","J.K. Rowling;Mary GrandPré","Harry Potter's life is miserable. His parents are dead and he's stuck with his heartless relatives, who force him to live in a tiny closet under the stairs. But his fortune changes when he receives a letter that tells him the truth about himself: he's a wizard. A mysterious visitor rescues him from his relatives and takes him to his new home, Hogwarts School of Witchcraft
  Harry Potter's life is miserable. His parents are dead and he's stuck with his heartless relatives, who force him to live in a tiny closet under the stairs. But his fortune changes when he receives a letter that tells him the truth about himself: he's a wizard. A mysterious visitor rescues him from his relatives and takes him to his new home, Hogwarts School of Witchcraft and Wizardry.After a lifetime of bottling up his magical powers, Harry finally feels like a normal kid. But even within the Wizarding community, he is special. He is the boy who lived: the only person to have ever survived a killing curse inflicted by the evil Lord Voldemort, who launched a brutal takeover of the Wizarding world, only to vanish after failing to kill Harry.Though Harry's first year at Hogwarts is the best of his life, not everything is perfect. There is a dangerous secret object hidden within the castle walls, and Harry believes it's his responsibility to prevent it from falling into evil hands. But doing so will bring him into contact with forces more terrifying than he ever could have imagined.Full of sympathetic characters, wildly imaginative situations, and countless exciting details, the first installment in the series assembles an unforgettable magical world and sets the stage for many high-stakes adventures to come.
  ...more","/genres/fantasy;/genres/young-adult;/genres/fiction;/genres/magic;/genres/childrens;/genres/adventure;/genres/classics;/genres/middle-grade;/genres/science-fiction-fantasy;/genres/novels","45,085 users;14,524 users;12,635 users;4,149 users;3,709 users;2,373 users;1,762 users;1,387 users;1,349 users;1,029 users"
"75","/book/show/17899948-rebecca","Rebecca","Daphne du Maurier","Last night I dreamt I went to Manderley again . . .The novel begins in Monte Carlo, where our heroine is swept off her feet by the dashing widower Maxim de Winter and his sudden proposal of marriage. Orphaned and working as a lady's maid, she can barely believe her luck. It is only when they arrive at his massive country estate that she realizes how large a shadow his late
  Last night I dreamt I went to Manderley again . . .The novel begins in Monte Carlo, where our heroine is swept off her feet by the dashing widower Maxim de Winter and his sudden proposal of marriage. Orphaned and working as a lady's maid, she can barely believe her luck. It is only when they arrive at his massive country estate that she realizes how large a shadow his late wife will cast over their lives--presenting her with a lingering evil that threatens to destroy their marriage from beyond the grave.
  ...more","/genres/classics;/genres/fiction;/genres/mystery;/genres/romance;/genres/gothic;/genres/historical-fiction","7,271 users;3,487 users;2,451 users;1,318 users;1,236 users;724 users"
"76","/book/show/11486.The_Color_Purple","The Color Purple","Alice Walker","The Color Purple is a 1982 epistolary novel by American author Alice Walker which won the 1983 Pulitzer Prize for Fiction and the National Book Award for Fiction. It was later adapted into a film and musical of the same name.Taking place mostly in rural Georgia, the story focuses on the life of women of color in the southern United States in the 1930s, addressing numerous
  The Color Purple is a 1982 epistolary novel by American author Alice Walker which won the 1983 Pulitzer Prize for Fiction and the National Book Award for Fiction. It was later adapted into a film and musical of the same name.Taking place mostly in rural Georgia, the story focuses on the life of women of color in the southern United States in the 1930s, addressing numerous issues including their exceedingly low position in American social culture. The novel has been the frequent target of censors and appears on the American Library Association list of the 100 Most Frequently Challenged Books of 2000-2009 at number seventeen because of the sometimes explicit content, particularly in terms of violence.
  ...more","/genres/classics;/genres/fiction;/genres/historical-fiction;/genres/feminism","863 users;673 users;414 users;331 users"
"77","/book/show/2429135.The_Girl_with_the_Dragon_Tattoo","The Girl with the Dragon Tattoo (Millennium, #1)","Stieg Larsson;Reg Keeland","Mikael Blomkvist, a once-respected financial journalist, watches his professional life rapidly crumble around him. Prospects appear bleak until an unexpected (and unsettling) offer to resurrect his name is extended by an old-school titan of Swedish industry. The catch—and there's always a catch—is that Blomkvist must first spend a year researching a mysterious disappearanc
  Mikael Blomkvist, a once-respected financial journalist, watches his professional life rapidly crumble around him. Prospects appear bleak until an unexpected (and unsettling) offer to resurrect his name is extended by an old-school titan of Swedish industry. The catch—and there's always a catch—is that Blomkvist must first spend a year researching a mysterious disappearance that has remained unsolved for nearly four decades. With few other options, he accepts and enlists the help of investigator Lisbeth Salander, a misunderstood genius with a cache of authority issues. Little is as it seems in Larsson's novel, but there is at least one constant: you really don't want to mess with the girl with the dragon tattoo.
  ...more","/genres/fiction;/genres/mystery;/genres/thriller;/genres/adult-fiction;/genres/sweden","1,550 users;1,496 users;952 users;703 users;684 users"
"78","/book/show/252577.Angela_s_Ashes","Angela's Ashes (Frank McCourt, #1)","Frank McCourt","“When I look back on my childhood I wonder how I managed to survive at all. It was, of course, a miserable childhood: the happy childhood is hardly worth your while. Worse than the ordinary miserable childhood is the miserable Irish childhood, and worse yet is the miserable Irish Catholic childhood.”So begins the luminous memoir of Frank McCourt, born in Depression-era Bro
  “When I look back on my childhood I wonder how I managed to survive at all. It was, of course, a miserable childhood: the happy childhood is hardly worth your while. Worse than the ordinary miserable childhood is the miserable Irish childhood, and worse yet is the miserable Irish Catholic childhood.”So begins the luminous memoir of Frank McCourt, born in Depression-era Brooklyn to recent Irish immigrants and raised in the slums of Limerick, Ireland. Frank’s mother, Angela, has no money to feed the children since Frank’s father, Malachy, rarely works, and when he does he drinks his wages. Yet Malachy — exasperating, irresponsible, and beguiling — does nurture in Frank an appetite for the one thing he can provide: a story. Frank lives for his father’s tales of Cuchulain, who saved Ireland, and of the Angel on the Seventh Step, who brings his mother babies.Perhaps it is story that accounts for Frank’s survival. Wearing rags for diapers, begging a pig’s head for Christmas dinner and gathering coal from the roadside to light a fire, Frank endures poverty, near-starvation and the casual cruelty of relatives and neighbors—yet lives to tell his tale with eloquence, exuberance, and remarkable forgiveness.Angela’s Ashes, imbued on every page with Frank McCourt’s astounding humor and compassion, is a glorious book that bears all the marks of a classic.
  ...more","/genres/non-fiction;/genres/memoir;/genres/ireland;/genres/classics;/genres/autobiography","2,779 users;847 users;541 users;536 users;460 users"
"79","/book/show/6288.The_Road","The Road","Cormac McCarthy","A searing, post apocalyptic novel destined to become Cormac McCarthy’s masterpiece.A father and his son walk alone through burned America. Nothing moves in the ravaged landscape save the ash on the wind. It is cold enough to crack stones, and when the snow falls it is gray. The sky is dark. Their destination is the coast, although they don’t know what, if anything, awaits
  A searing, post apocalyptic novel destined to become Cormac McCarthy’s masterpiece.A father and his son walk alone through burned America. Nothing moves in the ravaged landscape save the ash on the wind. It is cold enough to crack stones, and when the snow falls it is gray. The sky is dark. Their destination is the coast, although they don’t know what, if anything, awaits them there. They have nothing; just a pistol to defend themselves against the lawless bands that stalk the road, the clothes they are wearing, a cart of scavenged food—and each other.
  ...more","/genres/science-fiction;/genres/dystopia;/genres/fiction;/genres/horror","1,995 users;1,650 users;985 users;915 users"
"80","/book/show/227463.A_Clockwork_Orange","A Clockwork Orange","Anthony Burgess","A vicious fifteen-year-old ""droog"" is the central character of this 1963 classic, whose stark terror was captured in Stanley Kubrick's magnificent film of the same title.In Anthony Burgess's nightmare vision of the future, where criminals take over after dark, the story is told by the central character, Alex, who talks in a brutal invented slang that brilliantly renders hi
  A vicious fifteen-year-old ""droog"" is the central character of this 1963 classic, whose stark terror was captured in Stanley Kubrick's magnificent film of the same title.In Anthony Burgess's nightmare vision of the future, where criminals take over after dark, the story is told by the central character, Alex, who talks in a brutal invented slang that brilliantly renders his and his friends' social pathology. A Clockwork Orange is a frightening fable about good and evil, and the meaning of human freedom. When the state undertakes to reform Alex—to ""redeem"" him—the novel asks, ""At what cost?""This edition includes the controversial last chapter not published in the first edition and Burgess's introduction ""A Clockwork Orange Resucked"".
  ...more","/genres/science-fiction;/genres/dystopia;/genres/classics;/genres/literature;/genres/novels;/genres/horror;/genres/fiction","1,233 users;1,177 users;890 users;653 users;429 users;387 users;272 users"
