"rank","itemUrl","itemTitle","author","description","genres","genrecount"
"17","/book/show/24213.Alice_s_Adventures_in_Wonderland_Through_the_Looking_Glass","Alice's Adventures in Wonderland & Through the Looking-Glass","Lewis Carroll;John Tenniel;Martin Gardner","Weary of her storybook, one ""without pictures or conversations,"" the young and imaginative Alice follows a hasty hare underground--to come face-to-face with some of the strangest adventures and most fantastic characters in all of literature. The Ugly Duchess, the Mad Hatter, the weeping Mock Turtle, the diabolical Queen of Hearts, the Cheshire Cat--each more eccentric than
  Weary of her storybook, one ""without pictures or conversations,"" the young and imaginative Alice follows a hasty hare underground--to come face-to-face with some of the strangest adventures and most fantastic characters in all of literature. The Ugly Duchess, the Mad Hatter, the weeping Mock Turtle, the diabolical Queen of Hearts, the Cheshire Cat--each more eccentric than the last--could only have come from that master of sublime nonsense, Lewis Carroll. In penning this brilliant burlesque of children's literature, Carroll has written a farcical satire of rigid Victorian society, an arresting parody of the fears, anxieties, and complexities of growing up. Carroll was one of the few adult writers to successfully enter the children's world of make-believe: where the impossible becomes possible, the unreal--real, and where the height of adventure is limited only by the depths of imagination.
  ...more","/genres/classics;/genres/fantasy;/genres/fiction;/genres/childrens;/genres/young-adult","8,664 users;4,781 users;3,110 users;1,601 users;757 users"
"18","/book/show/24280.Les_Mis_rables","Les Misérables","Victor Hugo;Lee Fahnestock;Norman MacAfee","Introducing one of the most famous characters in literature, Jean Valjean—the noble peasant imprisoned for stealing a loaf of bread—Les Misérables ranks among the greatest novels of all time. In it, Victor Hugo takes readers deep into the Parisian underworld, immerses them in a battle between good and evil, and carries them to the barricades during the uprising of 1832 wit
  Introducing one of the most famous characters in literature, Jean Valjean—the noble peasant imprisoned for stealing a loaf of bread—Les Misérables ranks among the greatest novels of all time. In it, Victor Hugo takes readers deep into the Parisian underworld, immerses them in a battle between good and evil, and carries them to the barricades during the uprising of 1832 with a breathtaking realism that is unsurpassed in modern prose. Within his dramatic story are themes that capture the intellect and the emotions: crime and punishment, the relentless persecution of Valjean by Inspector Javert, the desperation of the prostitute Fantine, the amorality of the rogue Thénardier, and the universal desire to escape the prisons of our own minds. Les Misérables gave Victor Hugo a canvas upon which he portrayed his criticism of the French political and judicial systems, but the portrait that resulted is larger than life, epic in scope—an extravagant spectacle that dazzles the senses even as it touches the heart.
  ...more","/genres/classics;/genres/fiction;/genres/historical-fiction;/genres/literature","11,869 users;3,712 users;2,004 users;857 users"
"19","/book/show/13335037-divergent","Divergent (Divergent, #1)","Veronica Roth","Paperback features over fifty pages of bonus materials, including a sneak peek of Insurgent, an author Q&A, a discussion guide, a Divergent playlist, faction manifestos, and more!In Beatrice Prior's dystopian Chicago world, society is divided into five factions, each dedicated to the cultivation of a particular virtue—Candor (the honest), Abnegation (the selfless), Dau
  Paperback features over fifty pages of bonus materials, including a sneak peek of Insurgent, an author Q&A, a discussion guide, a Divergent playlist, faction manifestos, and more!In Beatrice Prior's dystopian Chicago world, society is divided into five factions, each dedicated to the cultivation of a particular virtue—Candor (the honest), Abnegation (the selfless), Dauntless (the brave), Amity (the peaceful), and Erudite (the intelligent). On an appointed day of every year, all sixteen-year-olds must select the faction to which they will devote the rest of their lives. For Beatrice, the decision is between staying with her family and being who she really is—she can't have both. So she makes a choice that surprises everyone, including herself.During the highly competitive initiation that follows, Beatrice renames herself Tris and struggles alongside her fellow initiates to live out the choice they have made. Together they must undergo extreme physical tests of endurance and intense psychological simulations, some with devastating consequences. As initiation transforms them all, Tris must determine who her friends really are—and where, exactly, a romance with a sometimes fascinating, sometimes exasperating boy fits into the life she's chosen. But Tris also has a secret, one she's kept hidden from everyone because she's been warned it can mean death. And as she discovers unrest and growing conflict that threaten to unravel her seemingly perfect society, she also learns that her secret might help her save those she loves . . . or it might destroy her.Veronica Roth is the New York Times bestselling author of Divergent, the first in a trilogy of dystopian thrillers filled with electrifying decisions, heartbreaking betrayals, stunning consequences, and unexpected romance.
  ...more","/genres/young-adult;/genres/dystopia;/genres/fiction;/genres/fantasy;/genres/science-fiction","17,561 users;11,863 users;5,481 users;4,972 users;4,767 users"
"20","/book/show/18135.Romeo_and_Juliet","Romeo and Juliet","William Shakespeare;Robert           Jackson","In Romeo and Juliet, Shakespeare creates a world of violence and generational conflict in which two young people fall in love and die because of that love. The story is rather extraordinary in that the normal problems faced by young lovers are here so very large. It is not simply that the families of Romeo and Juliet disapprove of the lover's affection for each other; rath
  In Romeo and Juliet, Shakespeare creates a world of violence and generational conflict in which two young people fall in love and die because of that love. The story is rather extraordinary in that the normal problems faced by young lovers are here so very large. It is not simply that the families of Romeo and Juliet disapprove of the lover's affection for each other; rather, the Montagues and the Capulets are on opposite sides in a blood feud and are trying to kill each other on the streets of Verona. Every time a member of one of the two families dies in the fight, his relatives demand the blood of his killer. Because of the feud, if Romeo is discovered with Juliet by her family, he will be killed. Once Romeo is banished, the only way that Juliet can avoid being married to someone else is to take a potion that apparently kills her, so that she is burried with the bodies of her slain relatives. In this violent, death-filled world, the movement of the story from love at first sight to the union of the lovers in death seems almost inevitable.What is so striking about this play is that despite its extraordinary setting (one perhaps reflecting Elizabethan attitudes about hot-blooded Italians), it has become the quintessential story of young love. Because most young lovers feel that they have to overcome giant obstacles in order to be together, because they feel that they would rather die than be kept apart, and especially because the language Shakespeare gives his young lovers is so exquisite, allowing them to say to each other just what we would all say to a lover if we only knew how, it is easy to respond to this play as if it were about all young lovers rather than about a particular couple in a very unusual world. (When the play was rewritten in the eighteen century as The History and Fall of Caius Marius, the violent setting became that of a particularly discordant period in classical Rome; when Leonard Berstein rewrote the play as West Side Story, he chose the violent world of New York street gangs.)
  ...more","/genres/classics;/genres/plays;/genres/fiction;/genres/romance;/genres/school;/genres/drama;/genres/read-for-school;/genres/literature;/genres/high-school;/genres/poetry","20,249 users;7,438 users;4,445 users;4,052 users;2,685 users;2,536 users;1,351 users;1,227 users;840 users;822 users"
"21","/book/show/5297.The_Picture_of_Dorian_Gray","The Picture of Dorian Gray","Oscar Wilde;Jeffrey Eugenides","Introduction by Jeffrey Eugenides  Written in his distinctively dazzling manner, Oscar Wilde’s story of a fashionable young man who sells his soul for eternal youth and beauty is the author’s most popular work. The tale of Dorian Gray’s moral disintegration caused a scandal when it ﬁrst appeared in 1890, but though Wilde was attacked for the novel’s corrupting inﬂuence, he
  ﻿Introduction by Jeffrey Eugenides  ﻿Written in his distinctively dazzling manner, Oscar Wilde’s story of a fashionable young man who sells his soul for eternal youth and beauty is the author’s most popular work. The tale of Dorian Gray’s moral disintegration caused a scandal when it ﬁrst appeared in 1890, but though Wilde was attacked for the novel’s corrupting inﬂuence, he responded that there is, in fact, “a terrible moral in Dorian Gray.” Just a few years later, the book and the aesthetic/moral dilemma it presented became issues in the trials occasioned by Wilde’s homosexual liaisons, which resulted in his imprisonment. Of Dorian Gray’s relationship to autobiography, Wilde noted in a letter, “Basil Hallward is what I think I am: Lord Henry what the world thinks me: Dorian what I would like to be—in other ages, perhaps.”
  ...more","/genres/classics;/genres/horror;/genres/fantasy;/genres/gothic;/genres/novels;/genres/19th-century;/genres/classic-literature;/genres/british-literature;/genres/school;/genres/victorian","2,842 users;1,802 users;1,450 users;975 users;646 users;639 users;440 users;407 users;353 users;341 users"
"22","/book/show/7624.Lord_of_the_Flies","Lord of the Flies","William Golding","When a plane crashes on a remote island, a small group of schoolboys are the sole survivors. From the prophetic Simon and virtuous Ralph to the lovable Piggy and brutish Jack, each of the boys attempts to establish control as the reality - and brutal savagery - of their situation sets in.The boys' struggle to find a way of existing in a community with no fixed boundaries i
  When a plane crashes on a remote island, a small group of schoolboys are the sole survivors. From the prophetic Simon and virtuous Ralph to the lovable Piggy and brutish Jack, each of the boys attempts to establish control as the reality - and brutal savagery - of their situation sets in.The boys' struggle to find a way of existing in a community with no fixed boundaries invites readers to evaluate the concepts involved in social and political constructs and moral frameworks. Ideas of community, leadership, and the rule of law are called into question as the reader has to consider who has a right to power, why, and what the consequences of the acquisition of power may be. Often compared to Catcher in the Rye, Lord of the Flies also represents a coming-of-age story of innocence lost.
  ...more","/genres/classics;/genres/fiction;/genres/young-adult;/genres/school;/genres/literature;/genres/dystopia;/genres/read-for-school;/genres/novels;/genres/adventure;/genres/high-school","19,681 users;10,697 users;2,689 users;2,040 users;1,712 users;1,530 users;951 users;872 users;783 users;721 users"
"23","/book/show/10210.Jane_Eyre","Jane Eyre","Charlotte Brontë;Michael Mason;Charlotte Brontë","Orphaned into the household of her Aunt Reed at Gateshead and subject to the cruel regime at Lowood charity school, Jane Eyre nonetheless emerges unbroken in spirit and integrity. She takes up the post of governess at Thornfield, falls in love with Mr. Rochester, and discovers the impediment to their lawful marriage in a story that transcends melodrama to portray a woman's
  Orphaned into the household of her Aunt Reed at Gateshead and subject to the cruel regime at Lowood charity school, Jane Eyre nonetheless emerges unbroken in spirit and integrity. She takes up the post of governess at Thornfield, falls in love with Mr. Rochester, and discovers the impediment to their lawful marriage in a story that transcends melodrama to portray a woman's passionate search for a wider and richer life than Victorian society traditionally allowed.With a heroine full of yearning, the dangerous secrets she encounters, and the choices she finally makes, Charlotte Bronte's innovative and enduring romantic novel continues to engage and provoke readers.
  ...more","/genres/literature;/genres/gothic;/genres/historical;/genres/19th-century;/genres/novels;/genres/british-literature","1,587 users;1,292 users;986 users;834 users;715 users;681 users"
"24","/book/show/865.The_Alchemist","The Alchemist","Paulo Coelho;Alan R. Clarke","Paulo Coelho's enchanting novel has inspired a devoted following around the world. This story, dazzling in its powerful simplicity and inspiring wisdom, is about an Andalusian shepherd boy named Santiago who travels from his homeland in Spain to the Egyptian desert in search of a treasure buried in the Pyramids. Along the way he meets a Gypsy woman, a man who calls himself
  Paulo Coelho's enchanting novel has inspired a devoted following around the world. This story, dazzling in its powerful simplicity and inspiring wisdom, is about an Andalusian shepherd boy named Santiago who travels from his homeland in Spain to the Egyptian desert in search of a treasure buried in the Pyramids. Along the way he meets a Gypsy woman, a man who calls himself king, and an alchemist, all of whom point Santiago in the direction of his quest. No one knows what the treasure is, or if Santiago will be able to surmount the obstacles along the way. But what starts out as a journey to find worldly goods turns into a discovery of the treasure found within. Lush, evocative, and deeply humane, the story of Santiago is an eternal testament to the transforming power of our dreams and the importance of listening to our hearts.
  ...more","/genres/fiction;/genres/classics;/genres/fantasy;/genres/philosophy","9,206 users;3,089 users;2,147 users;1,870 users"
"25","/book/show/375802.Ender_s_Game","Ender's Game (Ender's Saga, #1)","Orson Scott Card","Andrew ""Ender"" Wiggin thinks he is playing computer simulated war games; he is, in fact, engaged in something far more desperate. The result of genetic experimentation, Ender may be the military genius Earth desperately needs in a war against an alien enemy seeking to destroy all human life. The only way to find out is to throw Ender into ever harsher training, to chip awa
  Andrew ""Ender"" Wiggin thinks he is playing computer simulated war games; he is, in fact, engaged in something far more desperate. The result of genetic experimentation, Ender may be the military genius Earth desperately needs in a war against an alien enemy seeking to destroy all human life. The only way to find out is to throw Ender into ever harsher training, to chip away and find the diamond inside, or destroy him utterly. Ender Wiggin is six years old when it begins. He will grow up fast.But Ender is not the only result of the experiment. The war with the Buggers has been raging for a hundred years, and the quest for the perfect general has been underway almost as long. Ender's two older siblings, Peter and Valentine, are every bit as unusual as he is, but in very different ways. While Peter was too uncontrollably violent, Valentine very nearly lacks the capability for violence altogether. Neither was found suitable for the military's purpose. But they are driven by their jealousy of Ender, and by their inbred drive for power. Peter seeks to control the political process, to become a ruler. Valentine's abilities turn more toward the subtle control of the beliefs of commoner and elite alike, through powerfully convincing essays. Hiding their youth and identities behind the anonymity of the computer networks, these two begin working together to shape the destiny of Earth-an Earth that has no future at all if their brother Ender fails.~from author's web site
  ...more","/genres/science-fiction;/genres/fiction;/genres/young-adult;/genres/fantasy","12,723 users;5,791 users;3,893 users;2,304 users"
"26","/book/show/7144.Crime_and_Punishment","Crime and Punishment","Fyodor Dostoyevsky;David McDuff","Through the story of the brilliant but conflicted young Raskolnikov and the murder he commits, Fyodor Dostoevsky explores the theme of redemption through suffering. Crime and Punishment put Dostoevsky at the forefront of Russian writers when it appeared in 1866 and is now one of the most famous and influential novels in world literature.The poverty-stricken Raskolnikov, a
  Through the story of the brilliant but conflicted young Raskolnikov and the murder he commits, Fyodor Dostoevsky explores the theme of redemption through suffering. Crime and Punishment put Dostoevsky at the forefront of Russian writers when it appeared in 1866 and is now one of the most famous and influential novels in world literature.The poverty-stricken Raskolnikov, a talented student, devises a theory about extraordinary men being above the law, since in their brilliance they think “new thoughts” and so contribute to society. He then sets out to prove his theory by murdering a vile, cynical old pawnbroker and her sister. The act brings Raskolnikov into contact with his own buried conscience and with two characters — the deeply religious Sonia, who has endured great suffering, and Porfiry, the intelligent and discerning official who is charged with investigating the murder — both of whom compel Raskolnikov to feel the split in his nature. Dostoevsky provides readers with a suspenseful, penetrating psychological analysis that goes beyond the crime — which in the course of the novel demands drastic punishment — to reveal something about the human condition: The more we intellectualize, the more imprisoned we become.
  ...more","/genres/fiction;/genres/classics;/genres/literature;/genres/russia;/genres/novels;/genres/philosophy;/genres/crime;/genres/russian-literature;/genres/19th-century;/genres/classic-literature","5,407 users;1,806 users;1,349 users;785 users;678 users;598 users;533 users;504 users;428 users;350 users"
"27","/book/show/18619684-the-time-traveler-s-wife","The Time Traveler's Wife","Audrey Niffenegger","The Time Traveler’s Wife, one of the best romance books of all time, is now available as an eBook!Audrey Niffenegger's dazzling debut is the story of Clare, a beautiful, strong-minded art student, and Henry, an adventuresome librarian, who have known each other since Clare was six and Henry was thirty-six, and were married when Clare was twenty-three and Henry thirty-one.
  The Time Traveler’s Wife, one of the best romance books of all time, is now available as an eBook!Audrey Niffenegger's dazzling debut is the story of Clare, a beautiful, strong-minded art student, and Henry, an adventuresome librarian, who have known each other since Clare was six and Henry was thirty-six, and were married when Clare was twenty-three and Henry thirty-one. Impossible but true, because Henry is one of the first people diagnosed with Chrono-Displacement Disorder: his genetic clock randomly resets and he finds himself misplaced in time, pulled to moments of emotional gravity from his life, past and future. His disappearances are spontaneous and unpredictable, and lend a spectacular urgency to Clare and Henry's unconventional love story. That their attempt to live normal lives together is threatened by something they can neither prevent nor control makes their story intensely moving and entirely unforgettable.Plus, the long-awaited sequel to Audrey Niffenegger’s time-traveling love story is finally here!The ebook includes the first 25 pages of Niffeneger’s sequel featuring Henry and Clare’s daughter, Alba. Gifted with Clare’s beauty and Henry’s unique abilities, Alba finds herself caught between her real-time husband, Zach, and her other husband, Oliver, a fellow time-traveler and musician.Get your eBook today and dive into this classic romance novel. Find the rest of Audrey Niffenegger’s books here and more of the best love story books. Shop eBooks today!
  ...more","/genres/fiction;/genres/romance;/genres/fantasy;/genres/time-travel;/genres/science-fiction;/genres/contemporary","8,359 users;4,612 users;2,907 users;2,242 users;1,430 users;1,088 users"
"28","/book/show/256683.City_of_Bones","City of Bones (The Mortal Instruments, #1)","Cassandra Clare","When fifteen-year-old Clary Fray heads out to the Pandemonium Club in New York City, she hardly expects to witness a murder― much less a murder committed by three teenagers covered with strange tattoos and brandishing bizarre weapons. Then the body disappears into thin air. It's hard to call the police when the murderers are invisible to everyone else and when there is not
  When fifteen-year-old Clary Fray heads out to the Pandemonium Club in New York City, she hardly expects to witness a murder― much less a murder committed by three teenagers covered with strange tattoos and brandishing bizarre weapons. Then the body disappears into thin air. It's hard to call the police when the murderers are invisible to everyone else and when there is nothing―not even a smear of blood―to show that a boy has died. Or was he a boy?This is Clary's first meeting with the Shadowhunters, warriors dedicated to ridding the earth of demons. It's also her first encounter with Jace, a Shadowhunter who looks a little like an angel and acts a lot like a jerk. Within twenty-four hours Clary is pulled into Jace's world with a vengeance, when her mother disappears and Clary herself is attacked by a demon. But why would demons be interested in ordinary mundanes like Clary and her mother? And how did Clary suddenly get the Sight? The Shadowhunters would like to know... Exotic and gritty, exhilarating and utterly gripping, Cassandra Clare's ferociously entertaining fantasy takes readers on a wild ride that they will never want to end.
  ...more","/genres/young-adult;/genres/paranormal;/genres/romance;/genres/urban-fantasy;/genres/vampires;/genres/fiction","11,018 users;4,180 users;3,049 users;2,916 users;2,093 users;2,056 users"
"29","/book/show/24178.Charlotte_s_Web","Charlotte's Web","E.B. White;Garth Williams;Rosemary Wells","This beloved book by E. B. White, author of Stuart Little and The Trumpet of the Swan, is a classic of children's literature that is ""just about perfect.""Some Pig. Humble. Radiant. These are the words in Charlotte's Web, high up in Zuckerman's barn. Charlotte's spiderweb tells of her feelings for a little pig named Wilbur, who simply wants a friend. They also express the l
  This beloved book by E. B. White, author of Stuart Little and The Trumpet of the Swan, is a classic of children's literature that is ""just about perfect.""Some Pig. Humble. Radiant. These are the words in Charlotte's Web, high up in Zuckerman's barn. Charlotte's spiderweb tells of her feelings for a little pig named Wilbur, who simply wants a friend. They also express the love of a girl named Fern, who saved Wilbur's life when he was born the runt of his litter.E. B. White's Newbery Honor Book is a tender novel of friendship, love, life, and death that will continue to be enjoyed by generations to come. This edition contains color illustrations by Garth Williams, the acclaimed illustrator of E.B. White's Stuart Little and Laura Ingalls Wilder's Little House series, among many other books.Supports the Common Core State Standards
  ...more","/genres/classics;/genres/childrens;/genres/fiction","5,403 users;4,125 users;3,420 users"
